{
  "$schema": "./workflow.schema.json",
  "name": "product-development",
  "description": "Standard product development workflow with refinement, architecture, and build phases",
  "version": "1.9.0",
  "phases": [
    {
      "id": "Refinement",
      "name": "Refinement",
      "description": "Refine brainstormed ideas into clear, actionable requirements",
      "workers": [
        {
          "id": "refinement-ralph-loop",
          "type": "ralphLoop",
          "description": "Creates refinement draft from brainstorm",
          "maxAttempts": 3,
          "workers": [
            {
              "id": "refinement-agent",
              "type": "agent",
              "source": "agents/refinement.md",
              "description": "Creates refinement draft from brainstorm",
              "model": "opus"
            },
            {
              "id": "adversarial-refinement-agent",
              "type": "agent",
              "source": "agents/adversarial-refinement.md",
              "description": "Reviews refinement draft and identifies gaps",
              "model": "opus"
            }
          ]
        },
        {
          "id": "answer-bot",
          "type": "answerBot",
          "source": "agents/answer-bot.md",
          "description": "Answers questions about the refinement process",
          "model": "haiku"
        }
      ],
      "transitions": {
        "next": "Backlog"
      }
    },
    {
      "id": "Backlog",
      "name": "Backlog",
      "description": "Approved requirements ready for architecture design",
      "workers": [],
      "transitions": {
        "next": null,
        "manual": true
      }
    },
    {
      "id": "Architecture",
      "name": "Architecture",
      "description": "Design technical architecture based on refinement",
      "workers": [
        {
          "id": "architecture-ralph-loop",
          "type": "ralphLoop",
          "description": "Creates architecture draft from refinement",
          "maxAttempts": 3,
          "workers": [
            {
              "id": "architect-agent",
              "type": "agent",
              "source": "agents/architect.md",
              "description": "Creates architecture draft from refinement",
              "disallowTools": ["Skill(superpowers:*)"],
              "model": "opus"
            },
            {
              "id": "adversarial-architect-agent",
              "type": "agent",
              "source": "agents/adversarial-architect.md",
              "description": "Reviews architecture draft and identifies issues",
              "model": "opus"
            }
          ]
        }
      ],
      "transitions": {
        "next": "Architecture Review"
      }
    },
    {
      "id": "Architecture Review",
      "name": "Architecture Review",
      "description": "Human review of architecture before specification",
      "workers": [],
      "transitions": {
        "next": null,
        "manual": true
      }
    },
    {
      "id": "Specification",
      "name": "Specification",
      "description": "Create detailed implementation specification with wave-based tickets",
      "workers": [
        {
          "id": "specification-agent",
          "type": "agent",
          "source": "agents/specification.md",
          "description": "Creates executable specification from architecture",
          "disallowTools": ["TaskCreate", "TaskUpdate", "Skill(superpowers:*)"],
          "model": "opus"
        }
      ],
      "transitions": {
        "next": "Specification Review"
      }
    },
    {
      "id": "Specification Review",
      "name": "Specification Review",
      "description": "Human review of specification before build",
      "workers": [],
      "transitions": {
        "next": null,
        "manual": true
      }
    },
    {
      "id": "Build",
      "name": "Build",
      "description": "Execute specification tickets in waves with QA validation",
      "workers": [
        {
          "id": "taskmaster-agent",
          "type": "agent",
          "source": "agents/taskmaster.md",
          "description": "Creates build tickets from specification",
          "disallowTools": ["Skill(superpowers:*)"],
          "model": "sonnet"
        },
        {
          "id": "build-task-loop",
          "type": "taskLoop",
          "description": "Executes individual build tickets from specification",
          "maxAttempts": 100,
          "workers": [
            {
              "id": "build-ralph-loop",
              "type": "ralphLoop",
              "description": "Executes individual build tickets from specification",
              "maxAttempts": 2,
              "workers": [
                {
                  "id": "builder-agent",
                  "type": "agent",
                  "source": "agents/builder.md",
                  "description": "Executes individual build tickets from specification",
                  "disallowTools": ["Skill(superpowers:*)"],
                  "model": "haiku"
                },
                {
                  "id": "verify-spec-agent",
                  "type": "agent",
                  "source": "agents/verify-spec.md",
                  "description": "Verifies the specification of the individual build tasks against the specification",
                  "model": "haiku"
                },
                {
                  "id": "verify-quality-agent",
                  "type": "agent",
                  "source": "agents/verify-quality.md",
                  "description": "Verifies the quality of the individual build task code",
                  "disallowTools": ["TodoWrite"],
                  "model": "haiku"
                }
              ]
            }
          ]
        },
        {
          "id": "qa-agent",
          "type": "agent",
          "source": "agents/qa.md",
          "description": "Creates build tickets from specification",
          "model": "haiku"
        }
      ],
      "transitions": {
        "next": "Pull Requests"
      },
      "requiresWorktree": true
    },
    {
      "id": "Pull Requests",
      "name": "Pull Requests",
      "description": "Create pull request for completed build",
      "workers": [
        {
          "id": "pr-agent",
          "type": "agent",
          "source": "agents/pr-agent.md",
          "description": "Creates PR with documentation and screenshots"
        }
      ],
      "transitions": {
        "next": null
      }
    }
  ]
}
